{
    "$schema": "https://json-schema.org/draft/2020-12/schema",
    "$id": "synth-definition",
    "title": "Synthboss synth configuration schema",
    "description": "Declaration of a synth's parameters",
    "type": "object",
    "properties": {
        "manufacturer": {
            "type": "string"
        },
        "model": {
            "type": "string"
        },
        "shortname": {
            "type": "string",
            "pattern": "^[a-z0-9]{3,}$"
        },
        "parts": {
            "type": "array",
            "items": {
                "type": "object",
                "properties": {
                    "name": {
                        "type": "string"
                    },
                    "channel": {
                        "type": "integer"
                    },
                    "messageformat": {
                        "type": "array",
                        "items": {
                            "oneOf": [
                                {
                                    "type": "integer"
                                },
                                {
                                    "type": "string"
                                },
                                {
                                    "type": "object",
                                    "properties": {
                                        "op": {
                                            "type": "string"
                                        },
                                        "arg1": {
                                            "oneOf": [
                                                {
                                                    "type": "integer"
                                                },
                                                {
                                                    "type": "string"
                                                }
                                            ]
                                        },
                                        "arg2": {
                                            "oneOf": [
                                                {
                                                    "type": "integer"
                                                },
                                                {
                                                    "type": "string"
                                                }
                                            ]
                                        }
                                    },
                                    "required": ["op", "arg1", "arg2"]
                                }
                            ]
                        }
                    },
                    "sections": {
                        "type": "array",
                        "items": {
                            "type": "object",
                            "properties": {
                                "name": {
                                    "type": "string"
                                },
                                "parameters": {
                                    "type": "array",
                                    "items": {
                                        "type": "object",
                                        "properties": {
                                            "name": {
                                                "type": "string"
                                            },
                                            "parameternumber": {
                                                "type": "integer"
                                            },
                                            "class": {
                                                "type": "string"
                                            },
                                            "coherence": {
                                                "type": "integer"
                                            },
                                            "value": {
                                                "type": "integer"
                                            },
                                            "encoding": {
                                                "type": "object",
                                                "properties": {
                                                    "type": {
                                                        "type": "string"
                                                    },
                                                    "valuebits": {
                                                        "type": "integer"
                                                    },
                                                    "signbit": {
                                                        "type": "integer"
                                                    },
                                                    "offset": {
                                                        "type": "integer"
                                                    }
                                                },
                                                "dependencies" : {
                                                    "type": {
                                                        "oneOf": [
                                                            {
                                                                "properties": {"type": {"enum": ["unsigned"]}},
                                                                "required": ["valuebits"]
                                                            },
                                                            {
                                                                "properties": {"type": {"enum": ["signed"]}},
                                                                "required": ["valuebits", "signbit"]
                                                            }
                                                        ]
                                                    }
                                                }
                                            },
                                            "min": {
                                                "type": "integer"
                                            },
                                            "max": {
                                                "type": "integer"
                                            },
                                            "on": {
                                                "type": "integer"
                                            },
                                            "off": {
                                                "type": "integer"
                                            },
                                            "choices": {
                                                "type": "array",
                                                "items": {
                                                    "type": "object",
                                                    "properties": {
                                                        "name": {
                                                            "type": "string"
                                                        },
                                                        "optionvalue": {
                                                            "type": "integer"
                                                        }
                                                    }
                                                }
                                            }
                                        },
                                        "dependencies": {
                                            "class": {
                                                "oneOf": [
                                                    {
                                                        "properties": {"class": {"enum": ["range"]}},
                                                        "required": ["min", "max"]
                                                    },
                                                    {
                                                        "properties": {"class": {"enum": ["toggle"]}},
                                                        "required": ["on", "off"]
                                                    },
                                                    {
                                                        "properties": {"class": {"enum": ["select"]}},
                                                        "required": ["choices"]
                                                    }
                                                ]
                                            }
                                        },
                                        "required": [ "name", "parameternumber", "class", "value" ]
                                    }
                                }
                            },
                            "required": [ "parameters" ]
                        }
                    }
                },
                "required": [ "messageformat", "channel", "sections" ]
            }
        }
    },
    "required": [ "manufacturer", "model", "shortname" ]
}
